{"artifact_inventory":[{"artifact_id":"ARTIFACT-RC2-DRY-RUN-01-01","byte_count":309,"media_type":"text/markdown","path":"evidence/attempts/RC2-DRY-RUN-01/artifacts/assistant-output.md","sha256":"d852eb5edcac37a8f3e1bb4a49b3e2532fab42af02ee95373437c1257a2003c2"}],"attempt_id":"RC2-DRY-RUN-01","attempt_kind":"dry_run","configured_model":{"id":"not_reported","reasoning_effort":"not_reported","reporting_status":"not_reported","snapshot":"not_reported"},"configured_provider":{"id":"not_reported","reporting_status":"not_reported","version":"not_reported"},"deviations":[{"description":"The registered prompt limits the native mode to its read-only content preparation subset. Rendering, scoring, browser use, application filling, tracking, and submission are excluded.","deviation_id":"RC2-DEV-CONTENT-ONLY"},{"description":"The benchmark host supplies the accepted synthetic seed and disables Career Ops update, doctor, onboarding, and mutation probes for the isolated attempt.","deviation_id":"RC2-DEV-HOST-PREFLIGHT"}],"errors":[],"execution_attestation":"absent","identity_capture_policy":"explicit_runner_output_only","invocation":{"byte_count":2111,"path":"evidence/attempts/RC2-DRY-RUN-01/invocation.json","sha256":"55ecd51f76a09616499a24a118cc6afdb29dc99edcb74c618b7c7d7b6736bdcb"},"manifest_id":"RUNNER-MANIFEST-RC2-DRY-RUN-01","normalized_result":{"byte_count":1529,"path":"evidence/attempts/RC2-DRY-RUN-01/normalized-result.json","sha256":"e0b3056400498dc146479e7228dc4d53807ec3dab7ab6bccbfad87d93dad8fbe"},"observations":{"authentication_unavailable":false,"conflicting_terminal_events":false,"environment_unavailable":false,"exit_code":null,"external_runner_started":false,"malformed_event_count":0,"permission_denied":false,"process_signal":null,"provider_request":"not_made_by_design","route_unsupported":false,"sensitive_capture_blocked":false,"timed_out":false,"tool_budget_exceeded":false,"tool_call_count":0,"trusted_terminal_event":false,"trusted_terminal_success":null,"workspace_unchanged":true},"randomized_order":0,"recorded_at":"2026-08-24T05:39:31.341Z","registration_id":"RC2-CO-CLAUDE-CODE-2026-08-24-V2","repeat_index":0,"reported_model":{"id":"not_reported","reasoning_effort":"not_reported","reporting_status":"not_reported","snapshot":"not_reported"},"reported_provider":{"id":"not_reported","reporting_status":"not_reported","version":"not_reported"},"route_id":"co-claude-code","runner":{"binary_sha256":"a708ba811c4cc46907df358e22f2aa6da3dbc28192747e4d3c4a0869752fe722","id":"claude-code","version":"2.1.223"},"scenario_id":"FACT-01","schema_version":"1.0","seed_inventory":{"byte_count":529,"path":"evidence/attempts/RC2-DRY-RUN-01/seed-inventory.json","sha256":"11c511dd44bcc4ec640cbf943bd4e76becaa5c7f0e972e3c9e2e67fa26ca59c9"},"source_snapshot":{"byte_count":4111,"path":"source-snapshot.json","sha256":"2f300beb6c9dd630c5b83299a4870455c02f0fa5b5608d0f111395878e2a921c"},"terminal_status":"completed","termination_reason":"none","trace":{"byte_count":584,"path":"evidence/attempts/RC2-DRY-RUN-01/trace.json","sha256":"50df871494dcae0124135049d350045a3f7863a46acfa05fb79f9dbf5718be9e"},"usage":{"duration_ms":null,"input_tokens":null,"output_tokens":null,"total_cost_usd":null},"workspace_inventory":{"byte_count":4047,"path":"evidence/attempts/RC2-DRY-RUN-01/workspace-inventory.json","sha256":"b452d5586db02114e0da459eeaf672119f8eb3a92ed7ef0cbbf2e7bdf2c2ccd5"}}
